364,I wellere Britische Stadt isch s Hauptquartier vom MI6?,Zentralschweiz
406,I wellne Länder redet d Mensche Japanisch?,Zentralschweiz
340,Welles Gebüüde het nachem Burj Khalifa die meiste Stockwerk?,Zentralschweiz
287,Wie gross isch d Claudia Schiffer?,Zentralschweiz
394,List alle kanadische Grunge Plattelabel uf.,Zentralschweiz
335,Wer hets Buech die süüle vo de Welt gschribe?,Zentralschweiz
236,was isch s letze Werk vom Dan Brown?,Zentralschweiz
60,Wie vill Ihwohner het Maribor?,Zentralschweiz
338,Het Breaking Bad meh Episode als Game of Thrones?,Zentralschweiz
